{
  "protocol": "kata-eval/v1",
  "run_id": "release-0.2.0-corrective-20261012",
  "manifest": {
    "path": "manifest.json",
    "sha256": "4ec97ac8e8be817f12e2059e4ed3477f8eb16cf4f6d422f6963a3dbdde06732b"
  },
  "status": "succeeded",
  "started_at": "2026-10-12T09:05:46.346Z",
  "ended_at": "2026-10-12T09:06:30.483Z",
  "tool": {
    "id": "pi",
    "observed_version": "1.1.0",
    "model": "gpt-6-luna",
    "settings": {
      "cli_args": [
        "--print",
        "--no-session",
        "--no-context-files",
        "--no-skills",
        "--no-extensions",
        "--no-mcp",
        "--model",
        "gpt-6-luna",
        "--provider",
        "openai-codex",
        "--",
        "<frozen prompt>"
      ],
      "runner_adapter": {
        "id": "kata-eval-runner/v1",
        "sha256": "278468a2540656425e795763d7886f64d660047a4a2050a3cbf7ae44fd4cf208"
      }
    },
    "exit_code": 0
  },
  "frozen_inputs": [
    {
      "path": "inputs/brief.md",
      "sha256": "22d2dfbce4985ea35ffa731752949f54047ec0f84e7db40aca8af8ab53ea3c58"
    },
    {
      "path": "inputs/prompt.md",
      "sha256": "1275cddaed5ef629891a28a6cc72601999937f47391f71c2a00641ab3a610083"
    },
    {
      "path": "inputs/lys/lys.css",
      "sha256": "c76f4d3ea763d94527ca6b656d724772bfc5a5946e2096945ea69a047d7077fb"
    },
    {
      "path": "inputs/lys/lys.iife.js",
      "sha256": "f896aeae2c680c727d4bb933b9491b8dfa8abf70585359e8966e86987ac4d904"
    },
    {
      "path": "inputs/lys/NOTICE.md",
      "sha256": "e2677fbc9d4c0113ae9e254dada5a4f53e5b02c8b552617c961311db89b6114c"
    },
    {
      "path": "inputs/skill/references/change-over-time.md",
      "sha256": "eb395237d58a5f4d5e277d433bd744b943642684faed95d8102df4a54fbe4a3b"
    },
    {
      "path": "inputs/skill/references/comparison.md",
      "sha256": "fc20172f54b9999bf3c38d169091d1032fa61321c7e40e7c9ed2f9b187b5bb18"
    },
    {
      "path": "inputs/skill/references/composition.md",
      "sha256": "b6d6139d1f0c84126859127e581ce0be1154666a383ecbcbcf163f171f900100"
    },
    {
      "path": "inputs/skill/references/golden-cut.md",
      "sha256": "86ea110295ce70059ee60cbc78d0165493f3ce41ada275d5a6b566870c43c940"
    },
    {
      "path": "inputs/skill/references/hierarchy.md",
      "sha256": "0093c30b01c1b7c591c547d07d96827c72a5ab23227054be950416dcf5cd0779"
    },
    {
      "path": "inputs/skill/references/integration.md",
      "sha256": "3d67fcfe1c0161c85e51b57ea583251c1f9edb9e1114a7fda75607e91a58f779"
    },
    {
      "path": "inputs/skill/references/relationship.md",
      "sha256": "49857540dd3749e38417504a862c3e5f5775fb5daab874109bf4a63b4eaffd1e"
    },
    {
      "path": "inputs/skill/SKILL.md",
      "sha256": "a3c23e30cdb67929f5cb42dc9aa2d92a2c9799068809ebad23a65d6e378bb987"
    },
    {
      "path": "evaluator/answer-key.json",
      "sha256": "3d53ca63c970b641d36ce95748761da4bb728f62c95b330197d0a60f617cb370"
    }
  ],
  "artifacts": {
    "decision": {
      "path": "output/decision.json",
      "sha256": "b851aedb1e712fb5f96b67640afed94f9f3b3ccf0882cf767df6980e45d76f4e"
    },
    "lys_html": {
      "path": "output/slide.html",
      "sha256": "4087dfe4c76d457f734dd7e515f9cbc49247f0103c4a40a0e71e21571d5f1f6e"
    },
    "final_response": {
      "path": "output/final-response.md",
      "sha256": "6480fadcdc5729529d03ba3438abfa0fed0e5c94ef5ac8755328bfe249e18f32"
    },
    "log": {
      "path": "output/tool.log",
      "sha256": "39f59a51fd098a8feaf84bf63eaa86de6243fcc207394a3a938ec59a44b87215"
    }
  },
  "failure": null
}
