{
  "protocol": "kata-eval/v1",
  "run_id": "runner-smoke",
  "manifest": {
    "path": "manifest.json",
    "sha256": "d7213bb953dfcfd69f453d985b61de3185929787249868f84ab631802c94e605"
  },
  "status": "failed",
  "started_at": "2026-10-12T06:58:52.529Z",
  "ended_at": "2026-10-12T06:58:52.579Z",
  "tool": {
    "id": "codex",
    "observed_version": "codex-cli 0.162.1",
    "model": "gpt-6-luna",
    "settings": {
      "cli_args": [
        "exec",
        "--ephemeral",
        "--skip-git-repo-check",
        "-C",
        "/var/folders/5x/92_br_c51191x_mqv5grk7p00000gq/T/kata-eval-workspace-GEMP9X",
        "-s",
        "workspace-write",
        "-o",
        "/var/folders/5x/92_br_c51191x_mqv5grk7p00000gq/T/kata-eval-workspace-GEMP9X/output/final-response.md",
        "-m",
        "gpt-6-luna",
        "-"
      ]
    },
    "exit_code": 1
  },
  "frozen_inputs": [
    {
      "path": "inputs/brief.md",
      "sha256": "22d2dfbce4985ea35ffa731752949f54047ec0f84e7db40aca8af8ab53ea3c58"
    },
    {
      "path": "inputs/prompt.md",
      "sha256": "b39ebab06d03841a7c78f88696bbd8b7a4ca776ae20b049364b554be665a9376"
    },
    {
      "path": "inputs/lys/lys.css",
      "sha256": "c76f4d3ea763d94527ca6b656d724772bfc5a5946e2096945ea69a047d7077fb"
    },
    {
      "path": "inputs/lys/lys.iife.js",
      "sha256": "f896aeae2c680c727d4bb933b9491b8dfa8abf70585359e8966e86987ac4d904"
    },
    {
      "path": "inputs/lys/NOTICE.md",
      "sha256": "e2677fbc9d4c0113ae9e254dada5a4f53e5b02c8b552617c961311db89b6114c"
    },
    {
      "path": "evaluator/answer-key.json",
      "sha256": "3d53ca63c970b641d36ce95748761da4bb728f62c95b330197d0a60f617cb370"
    },
    {
      "path": "evaluator/reader-task.md",
      "sha256": "72a7c5c82a0fcce4cc563ccabf37e135d49d1231805e139fd11da4c17bdb8d70"
    }
  ],
  "artifacts": {
    "decision": null,
    "lys_html": null,
    "final_response": {
      "path": "output/final-response.md",
      "sha256": "e3b0c44298fc1c149afbf4c8996fb92427ae41e4649b934ca495991b7852b855"
    },
    "log": {
      "path": "output/tool.log",
      "sha256": "5030b40d21eb08399acc81c0e6b9cb714391bc2235a43c6598aacf91940341a7"
    }
  },
  "failure": {
    "reason": "CLI failure: exited with status 1"
  }
}
