{
  "protocol": "kata-eval/v1",
  "run_id": "release-0.2.0-corrective-20261012",
  "manifest": {
    "path": "manifest.json",
    "sha256": "976b3542035ac6b439b6c953807cfec99094fe539d2ecc475d5f1f9c6ae46e0a"
  },
  "status": "succeeded",
  "started_at": "2026-10-12T08:59:44.477Z",
  "ended_at": "2026-10-12T09:00:33.905Z",
  "tool": {
    "id": "pi",
    "observed_version": "1.1.0",
    "model": "gpt-6-luna",
    "settings": {
      "cli_args": [
        "--print",
        "--no-session",
        "--no-context-files",
        "--no-skills",
        "--no-extensions",
        "--no-mcp",
        "--model",
        "gpt-6-luna",
        "--provider",
        "openai-codex",
        "--",
        "<frozen prompt>"
      ],
      "runner_adapter": {
        "id": "kata-eval-runner/v1",
        "sha256": "278468a2540656425e795763d7886f64d660047a4a2050a3cbf7ae44fd4cf208"
      }
    },
    "exit_code": 0
  },
  "frozen_inputs": [
    {
      "path": "inputs/brief.md",
      "sha256": "f28885c95f4d23075eb72a6bd8b5d780133263e1a9dcb730b4e17e500b3b003d"
    },
    {
      "path": "inputs/prompt.md",
      "sha256": "957ee2a345b5452472a152434cba7f83479e3d354156ee60eb4434aa6b16bfdf"
    },
    {
      "path": "inputs/lys/lys.css",
      "sha256": "c76f4d3ea763d94527ca6b656d724772bfc5a5946e2096945ea69a047d7077fb"
    },
    {
      "path": "inputs/lys/lys.iife.js",
      "sha256": "f896aeae2c680c727d4bb933b9491b8dfa8abf70585359e8966e86987ac4d904"
    },
    {
      "path": "inputs/lys/NOTICE.md",
      "sha256": "e2677fbc9d4c0113ae9e254dada5a4f53e5b02c8b552617c961311db89b6114c"
    },
    {
      "path": "inputs/skill/references/change-over-time.md",
      "sha256": "eb395237d58a5f4d5e277d433bd744b943642684faed95d8102df4a54fbe4a3b"
    },
    {
      "path": "inputs/skill/references/comparison.md",
      "sha256": "fc20172f54b9999bf3c38d169091d1032fa61321c7e40e7c9ed2f9b187b5bb18"
    },
    {
      "path": "inputs/skill/references/composition.md",
      "sha256": "b6d6139d1f0c84126859127e581ce0be1154666a383ecbcbcf163f171f900100"
    },
    {
      "path": "inputs/skill/references/golden-cut.md",
      "sha256": "86ea110295ce70059ee60cbc78d0165493f3ce41ada275d5a6b566870c43c940"
    },
    {
      "path": "inputs/skill/references/hierarchy.md",
      "sha256": "0093c30b01c1b7c591c547d07d96827c72a5ab23227054be950416dcf5cd0779"
    },
    {
      "path": "inputs/skill/references/integration.md",
      "sha256": "3d67fcfe1c0161c85e51b57ea583251c1f9edb9e1114a7fda75607e91a58f779"
    },
    {
      "path": "inputs/skill/references/relationship.md",
      "sha256": "49857540dd3749e38417504a862c3e5f5775fb5daab874109bf4a63b4eaffd1e"
    },
    {
      "path": "inputs/skill/SKILL.md",
      "sha256": "a3c23e30cdb67929f5cb42dc9aa2d92a2c9799068809ebad23a65d6e378bb987"
    },
    {
      "path": "evaluator/answer-key.json",
      "sha256": "89f4e89007e1eba734eac3f876e9e2c7f95c7f64cc59352d537c6783b8bb8102"
    }
  ],
  "artifacts": {
    "decision": {
      "path": "output/decision.json",
      "sha256": "0141e869a897a453b3655137580750c4d43d9da831016ad344ae56d32c13ffb5"
    },
    "lys_html": {
      "path": "output/slide.html",
      "sha256": "75f0cfcec0b9815124713204b9b9cf591bba854515aa393b89658e2960ef4d64"
    },
    "final_response": {
      "path": "output/final-response.md",
      "sha256": "904d849fe990bf61f28ee816a08b7102b808be568bd021e4a2dff4ae81616305"
    },
    "log": {
      "path": "output/tool.log",
      "sha256": "30fd805aee7a41c1e218340ab4e5b45cfa7cb3a70fb350ac4d80f1973ecace15"
    }
  },
  "failure": null
}
