{
  "protocol": "kata-eval/v1",
  "run_id": "choice-candidate",
  "manifest": {
    "path": "manifest.json",
    "sha256": "6c6c2b911fd16e6f5798959ae1beb4962ddb7a08e69a017508bf6ef16f9ae10b"
  },
  "status": "succeeded",
  "started_at": "2026-10-15T11:09:55.006Z",
  "ended_at": "2026-10-15T11:11:30.621Z",
  "tool": {
    "id": "codex",
    "observed_version": "codex-cli 0.162.1",
    "model": "gpt-6-luna",
    "settings": {
      "cli_args": [
        "exec",
        "--ephemeral",
        "--skip-git-repo-check",
        "-C",
        "/var/folders/5x/92_br_c51191x_mqv5grk7p00000gq/T/kata-eval-workspace-rfiz8I",
        "-s",
        "workspace-write",
        "-o",
        "/var/folders/5x/92_br_c51191x_mqv5grk7p00000gq/T/kata-eval-workspace-rfiz8I/output/final-response.md",
        "-m",
        "gpt-6-luna",
        "-"
      ],
      "runner_adapter": {
        "id": "kata-eval-runner/v1",
        "sha256": "278468a2540656425e795763d7886f64d660047a4a2050a3cbf7ae44fd4cf208"
      }
    },
    "exit_code": 0
  },
  "frozen_inputs": [
    {
      "path": "inputs/brief.md",
      "sha256": "8f7fea7816d218b1b49bb3f962920b181d32df51d58f6d6987206786889cd690"
    },
    {
      "path": "inputs/prompt.md",
      "sha256": "c008a618c2410a081914971830d3528d12bb1d9e3f1b4487d99d640029b5fbf3"
    },
    {
      "path": "inputs/lys/lys.css",
      "sha256": "c76f4d3ea763d94527ca6b656d724772bfc5a5946e2096945ea69a047d7077fb"
    },
    {
      "path": "inputs/lys/lys.iife.js",
      "sha256": "f896aeae2c680c727d4bb933b9491b8dfa8abf70585359e8966e86987ac4d904"
    },
    {
      "path": "inputs/lys/NOTICE.md",
      "sha256": "e2677fbc9d4c0113ae9e254dada5a4f53e5b02c8b552617c961311db89b6114c"
    },
    {
      "path": "inputs/skill/references/change-over-time.md",
      "sha256": "2aa7a89ba7d9d27a5e524cf2f9190039f047bcce0a27e55ff5bb0d12f93db4a4"
    },
    {
      "path": "inputs/skill/references/comparison.md",
      "sha256": "31e048255b9752e2d50fa4313433c15030960cb2dc4cfca07c83b37150d495ae"
    },
    {
      "path": "inputs/skill/references/composition.md",
      "sha256": "621583f2051dca0b6c2a3e1e227b31a3a565469677e20dfbafddc2a5ba9dc23d"
    },
    {
      "path": "inputs/skill/references/golden-cut.md",
      "sha256": "18a56674290c0c5bb681db5f456dfa0a9a1a6f5053b4a92ce13e8c29a4f84900"
    },
    {
      "path": "inputs/skill/references/hierarchy.md",
      "sha256": "397e49e736367459aab9f584ca6de7f41248895afcda9faeb367e94f2e6042af"
    },
    {
      "path": "inputs/skill/references/integration.md",
      "sha256": "80fe528f6a47387b644c4a6a24aa061fe2e027c25da113429fb7192948821ddb"
    },
    {
      "path": "inputs/skill/references/layout-assessment.md",
      "sha256": "9bf343725c48b925057bd66983bb5b93245324d1be18d24d8e6493e879da2790"
    },
    {
      "path": "inputs/skill/references/relationship.md",
      "sha256": "e2d6dd0bde2c531ffc2c40fbba589f2348988d5650e25ec992fc2e19ac339b63"
    },
    {
      "path": "inputs/skill/SKILL.md",
      "sha256": "db80769161fb5068ce22b80ca02c49d009aec1d3e6698b1eea511b43068f6233"
    },
    {
      "path": "evaluator/answer-key.json",
      "sha256": "fb28c224e3176924deac82dc5d37d33f96662c334fd233e631deeaca2d084c77"
    }
  ],
  "artifacts": {
    "decision": {
      "path": "output/decision.json",
      "sha256": "bb23f3a1b48a2b2d0d7119972e908e3ada907aa673f790b5e459ad22f17884f6"
    },
    "lys_html": {
      "path": "output/slide.html",
      "sha256": "144a6fdee45fdfa8c9bfcf009335a5a8a6f4aae3e42447425eb45da7dcf6b9ea"
    },
    "final_response": {
      "path": "output/final-response.md",
      "sha256": "61866f9667f025621fbe9aec6176d7371fd4d8a1d026be27b18988c81fa6017b"
    },
    "log": {
      "path": "output/tool.log",
      "sha256": "4362f5a50e5836ed10aa83421bbd815fb9a886d57fbd3ff0f0babf3051221f56"
    }
  },
  "failure": null
}
