{
  "protocol": "kata-eval/v1",
  "run_id": "release-0.2.0-20261012",
  "manifest": {
    "path": "manifest.json",
    "sha256": "42e4e72b01052cafe8a6d6b1ba60eae09e29a3aa49af819c64385608ecf1f378"
  },
  "status": "succeeded",
  "started_at": "2026-10-12T07:23:05.106Z",
  "ended_at": "2026-10-12T07:23:35.749Z",
  "tool": {
    "id": "pi",
    "observed_version": "1.1.0",
    "model": "gpt-6-luna",
    "settings": {
      "cli_args": [
        "--print",
        "--no-session",
        "--no-context-files",
        "--no-skills",
        "--no-extensions",
        "--no-mcp",
        "--model",
        "gpt-6-luna",
        "--provider",
        "openai-codex",
        "--",
        "<frozen prompt>"
      ],
      "runner_adapter": {
        "id": "kata-eval-runner/v1",
        "sha256": "278468a2540656425e795763d7886f64d660047a4a2050a3cbf7ae44fd4cf208"
      }
    },
    "exit_code": 0
  },
  "frozen_inputs": [
    {
      "path": "inputs/brief.md",
      "sha256": "22d2dfbce4985ea35ffa731752949f54047ec0f84e7db40aca8af8ab53ea3c58"
    },
    {
      "path": "inputs/prompt.md",
      "sha256": "c521ed5e8e51e6c2f63c0912e40ec5d5bc2a2e4839484284a248a7cdcac75295"
    },
    {
      "path": "inputs/lys/lys.css",
      "sha256": "c76f4d3ea763d94527ca6b656d724772bfc5a5946e2096945ea69a047d7077fb"
    },
    {
      "path": "inputs/lys/lys.iife.js",
      "sha256": "f896aeae2c680c727d4bb933b9491b8dfa8abf70585359e8966e86987ac4d904"
    },
    {
      "path": "inputs/lys/NOTICE.md",
      "sha256": "e2677fbc9d4c0113ae9e254dada5a4f53e5b02c8b552617c961311db89b6114c"
    },
    {
      "path": "evaluator/answer-key.json",
      "sha256": "3d53ca63c970b641d36ce95748761da4bb728f62c95b330197d0a60f617cb370"
    }
  ],
  "artifacts": {
    "decision": {
      "path": "output/decision.json",
      "sha256": "b09fab2ac132620a1553f8a5cda5b8eaa93d3c965525e6e32f815d0f2776f887"
    },
    "lys_html": {
      "path": "output/slide.html",
      "sha256": "b22fd9e368646ed3556267f87443f576a21e200b917819b842acde6ce731a549"
    },
    "final_response": {
      "path": "output/final-response.md",
      "sha256": "47e16592ef076ddff5a7414349e63cbade3f1f858f59a10b15653b3badef43ed"
    },
    "log": {
      "path": "output/tool.log",
      "sha256": "0882b3979c4e4c32e234cb8e733e685b0b03e91f98028c452eb4997df729bf67"
    }
  },
  "failure": null
}
