{
  "protocol": "kata-eval/v1",
  "run_id": "release-0.2.0-20261012",
  "manifest": {
    "path": "manifest.json",
    "sha256": "57b86467c5ab6c5a9e536b3eba14e166638870eeb46cfca923cab964ee2567cd"
  },
  "status": "succeeded",
  "started_at": "2026-10-12T07:13:48.679Z",
  "ended_at": "2026-10-12T07:14:17.069Z",
  "tool": {
    "id": "pi",
    "observed_version": "1.1.0",
    "model": "gpt-6-luna",
    "settings": {
      "cli_args": [
        "--print",
        "--no-session",
        "--no-context-files",
        "--no-skills",
        "--no-extensions",
        "--no-mcp",
        "--model",
        "gpt-6-luna",
        "--provider",
        "openai-codex",
        "--",
        "<frozen prompt>"
      ],
      "runner_adapter": {
        "id": "kata-eval-runner/v1",
        "sha256": "278468a2540656425e795763d7886f64d660047a4a2050a3cbf7ae44fd4cf208"
      }
    },
    "exit_code": 0
  },
  "frozen_inputs": [
    {
      "path": "inputs/brief.md",
      "sha256": "f28885c95f4d23075eb72a6bd8b5d780133263e1a9dcb730b4e17e500b3b003d"
    },
    {
      "path": "inputs/prompt.md",
      "sha256": "c363447092b67cae380cdce796ce4181f02e1fcbc912c108168132ab6230ad3a"
    },
    {
      "path": "inputs/lys/lys.css",
      "sha256": "c76f4d3ea763d94527ca6b656d724772bfc5a5946e2096945ea69a047d7077fb"
    },
    {
      "path": "inputs/lys/lys.iife.js",
      "sha256": "f896aeae2c680c727d4bb933b9491b8dfa8abf70585359e8966e86987ac4d904"
    },
    {
      "path": "inputs/lys/NOTICE.md",
      "sha256": "e2677fbc9d4c0113ae9e254dada5a4f53e5b02c8b552617c961311db89b6114c"
    },
    {
      "path": "inputs/skill/references/change-over-time.md",
      "sha256": "eb395237d58a5f4d5e277d433bd744b943642684faed95d8102df4a54fbe4a3b"
    },
    {
      "path": "inputs/skill/references/comparison.md",
      "sha256": "fc20172f54b9999bf3c38d169091d1032fa61321c7e40e7c9ed2f9b187b5bb18"
    },
    {
      "path": "inputs/skill/references/composition.md",
      "sha256": "b6d6139d1f0c84126859127e581ce0be1154666a383ecbcbcf163f171f900100"
    },
    {
      "path": "inputs/skill/references/hierarchy.md",
      "sha256": "0093c30b01c1b7c591c547d07d96827c72a5ab23227054be950416dcf5cd0779"
    },
    {
      "path": "inputs/skill/references/integration.md",
      "sha256": "3d67fcfe1c0161c85e51b57ea583251c1f9edb9e1114a7fda75607e91a58f779"
    },
    {
      "path": "inputs/skill/references/relationship.md",
      "sha256": "49857540dd3749e38417504a862c3e5f5775fb5daab874109bf4a63b4eaffd1e"
    },
    {
      "path": "inputs/skill/SKILL.md",
      "sha256": "a09260e864ea2cef5ef7d85493c9a2390c8418cb5837b29d4228b1922f1d37bf"
    },
    {
      "path": "evaluator/answer-key.json",
      "sha256": "89f4e89007e1eba734eac3f876e9e2c7f95c7f64cc59352d537c6783b8bb8102"
    }
  ],
  "artifacts": {
    "decision": {
      "path": "output/decision.json",
      "sha256": "fa34bf2f5cd288523913a09df7e7abc98cfcae4c8f57c7855e244fe3068d3cb9"
    },
    "lys_html": {
      "path": "output/slide.html",
      "sha256": "fc29c73e0b21056eb070febf6c95af52f8f2304a4b6537c2811339ca85b8c39e"
    },
    "final_response": {
      "path": "output/final-response.md",
      "sha256": "b197860c8c7677a73fd56ce91d6ab6b4a3f4b31c1e26de033f86b5162d2e01ae"
    },
    "log": {
      "path": "output/tool.log",
      "sha256": "a780b2a73227a065736e7398297a46c596c4c9b23f3edffb058bbc504ed5988f"
    }
  },
  "failure": null
}
