{
  "protocol": "kata-eval/v1",
  "run_id": "release-0.2.0-corrective-20261012",
  "manifest": {
    "path": "manifest.json",
    "sha256": "cef37c35376828144454e2fc1afdd6a53c915c80b7bbe532333779d1f591d4db"
  },
  "status": "succeeded",
  "started_at": "2026-10-12T08:59:44.373Z",
  "ended_at": "2026-10-12T09:00:25.879Z",
  "tool": {
    "id": "codex",
    "observed_version": "codex-cli 0.162.1",
    "model": "gpt-6-luna",
    "settings": {
      "cli_args": [
        "exec",
        "--ephemeral",
        "--skip-git-repo-check",
        "-C",
        "/var/folders/5x/92_br_c51191x_mqv5grk7p00000gq/T/kata-eval-workspace-uN2BHu",
        "-s",
        "workspace-write",
        "-o",
        "/var/folders/5x/92_br_c51191x_mqv5grk7p00000gq/T/kata-eval-workspace-uN2BHu/output/final-response.md",
        "-m",
        "gpt-6-luna",
        "-"
      ],
      "runner_adapter": {
        "id": "kata-eval-runner/v1",
        "sha256": "278468a2540656425e795763d7886f64d660047a4a2050a3cbf7ae44fd4cf208"
      }
    },
    "exit_code": 0
  },
  "frozen_inputs": [
    {
      "path": "inputs/brief.md",
      "sha256": "f28885c95f4d23075eb72a6bd8b5d780133263e1a9dcb730b4e17e500b3b003d"
    },
    {
      "path": "inputs/prompt.md",
      "sha256": "957ee2a345b5452472a152434cba7f83479e3d354156ee60eb4434aa6b16bfdf"
    },
    {
      "path": "inputs/lys/lys.css",
      "sha256": "c76f4d3ea763d94527ca6b656d724772bfc5a5946e2096945ea69a047d7077fb"
    },
    {
      "path": "inputs/lys/lys.iife.js",
      "sha256": "f896aeae2c680c727d4bb933b9491b8dfa8abf70585359e8966e86987ac4d904"
    },
    {
      "path": "inputs/lys/NOTICE.md",
      "sha256": "e2677fbc9d4c0113ae9e254dada5a4f53e5b02c8b552617c961311db89b6114c"
    },
    {
      "path": "inputs/skill/references/change-over-time.md",
      "sha256": "eb395237d58a5f4d5e277d433bd744b943642684faed95d8102df4a54fbe4a3b"
    },
    {
      "path": "inputs/skill/references/comparison.md",
      "sha256": "fc20172f54b9999bf3c38d169091d1032fa61321c7e40e7c9ed2f9b187b5bb18"
    },
    {
      "path": "inputs/skill/references/composition.md",
      "sha256": "b6d6139d1f0c84126859127e581ce0be1154666a383ecbcbcf163f171f900100"
    },
    {
      "path": "inputs/skill/references/golden-cut.md",
      "sha256": "86ea110295ce70059ee60cbc78d0165493f3ce41ada275d5a6b566870c43c940"
    },
    {
      "path": "inputs/skill/references/hierarchy.md",
      "sha256": "0093c30b01c1b7c591c547d07d96827c72a5ab23227054be950416dcf5cd0779"
    },
    {
      "path": "inputs/skill/references/integration.md",
      "sha256": "3d67fcfe1c0161c85e51b57ea583251c1f9edb9e1114a7fda75607e91a58f779"
    },
    {
      "path": "inputs/skill/references/relationship.md",
      "sha256": "49857540dd3749e38417504a862c3e5f5775fb5daab874109bf4a63b4eaffd1e"
    },
    {
      "path": "inputs/skill/SKILL.md",
      "sha256": "a3c23e30cdb67929f5cb42dc9aa2d92a2c9799068809ebad23a65d6e378bb987"
    },
    {
      "path": "evaluator/answer-key.json",
      "sha256": "89f4e89007e1eba734eac3f876e9e2c7f95c7f64cc59352d537c6783b8bb8102"
    }
  ],
  "artifacts": {
    "decision": {
      "path": "output/decision.json",
      "sha256": "5f0af70c02c5e6211571a4c3629af9216a56087be1a9f16d6d31e64fcfc9f472"
    },
    "lys_html": {
      "path": "output/slide.html",
      "sha256": "4524f3714e69376a8118b5674cdbeb133adee7c74be4dab979af1d9dc1178338"
    },
    "final_response": {
      "path": "output/final-response.md",
      "sha256": "2d2524798ef28e1974c2232535a56c6600e93adcc064c1cde3c58bd2aefaf847"
    },
    "log": {
      "path": "output/tool.log",
      "sha256": "b4aeeb5c77c0d1f88b96ed9215395d1093c30913e55fca23d0c33849994767cf"
    }
  },
  "failure": null
}
