{
  "protocol": "kata-eval/v1",
  "run_id": "runner-smoke",
  "manifest": {
    "path": "manifest.json",
    "sha256": "cfc7baa13054bdb7f97a0a3b90fd6766a7841d58be072fef2555b2a488e190ac"
  },
  "status": "failed",
  "started_at": "2026-10-12T06:58:52.388Z",
  "ended_at": "2026-10-12T06:58:52.470Z",
  "tool": {
    "id": "codex",
    "observed_version": "codex-cli 0.162.1",
    "model": "gpt-6-luna",
    "settings": {
      "cli_args": [
        "exec",
        "--ephemeral",
        "--skip-git-repo-check",
        "-C",
        "/var/folders/5x/92_br_c51191x_mqv5grk7p00000gq/T/kata-eval-workspace-mPOuxh",
        "-s",
        "workspace-write",
        "-o",
        "/var/folders/5x/92_br_c51191x_mqv5grk7p00000gq/T/kata-eval-workspace-mPOuxh/output/final-response.md",
        "-m",
        "gpt-6-luna",
        "-"
      ]
    },
    "exit_code": 1
  },
  "frozen_inputs": [
    {
      "path": "inputs/brief.md",
      "sha256": "f28885c95f4d23075eb72a6bd8b5d780133263e1a9dcb730b4e17e500b3b003d"
    },
    {
      "path": "inputs/prompt.md",
      "sha256": "a2478c032486dd707f25c7698ea4a8fce06e3becd23a42ab4748b84eaa22ce28"
    },
    {
      "path": "inputs/lys/lys.css",
      "sha256": "c76f4d3ea763d94527ca6b656d724772bfc5a5946e2096945ea69a047d7077fb"
    },
    {
      "path": "inputs/lys/lys.iife.js",
      "sha256": "f896aeae2c680c727d4bb933b9491b8dfa8abf70585359e8966e86987ac4d904"
    },
    {
      "path": "inputs/lys/NOTICE.md",
      "sha256": "e2677fbc9d4c0113ae9e254dada5a4f53e5b02c8b552617c961311db89b6114c"
    },
    {
      "path": "evaluator/answer-key.json",
      "sha256": "89f4e89007e1eba734eac3f876e9e2c7f95c7f64cc59352d537c6783b8bb8102"
    },
    {
      "path": "evaluator/reader-task.md",
      "sha256": "31f6de9cd404d0af618a3096ec178fc08c3a921e7d58c63319360265db85df40"
    }
  ],
  "artifacts": {
    "decision": null,
    "lys_html": null,
    "final_response": {
      "path": "output/final-response.md",
      "sha256": "e3b0c44298fc1c149afbf4c8996fb92427ae41e4649b934ca495991b7852b855"
    },
    "log": {
      "path": "output/tool.log",
      "sha256": "5030b40d21eb08399acc81c0e6b9cb714391bc2235a43c6598aacf91940341a7"
    }
  },
  "failure": {
    "reason": "CLI failure: exited with status 1"
  }
}
