{
  "protocol": "kata-eval/v1",
  "run_id": "release-0.2.0-20261012",
  "manifest": {
    "path": "manifest.json",
    "sha256": "158796a7c1c33ced7bd6a8af83f9a26fde558cbac170b9be836b58967b2d4d13"
  },
  "status": "succeeded",
  "started_at": "2026-10-12T07:24:40.511Z",
  "ended_at": "2026-10-12T07:26:08.088Z",
  "tool": {
    "id": "claude",
    "observed_version": "2.1.296 (Claude Code)",
    "model": "claude-haiku-5-5",
    "settings": {
      "cli_args": [
        "-p",
        "--output-format",
        "json",
        "--safe-mode",
        "--no-session-persistence",
        "--permission-mode",
        "acceptEdits",
        "--model",
        "haiku",
        "<frozen prompt>"
      ],
      "runner_adapter": {
        "id": "kata-eval-runner/v1",
        "sha256": "278468a2540656425e795763d7886f64d660047a4a2050a3cbf7ae44fd4cf208"
      }
    },
    "exit_code": 0
  },
  "frozen_inputs": [
    {
      "path": "inputs/brief.md",
      "sha256": "22d2dfbce4985ea35ffa731752949f54047ec0f84e7db40aca8af8ab53ea3c58"
    },
    {
      "path": "inputs/prompt.md",
      "sha256": "c521ed5e8e51e6c2f63c0912e40ec5d5bc2a2e4839484284a248a7cdcac75295"
    },
    {
      "path": "inputs/lys/lys.css",
      "sha256": "c76f4d3ea763d94527ca6b656d724772bfc5a5946e2096945ea69a047d7077fb"
    },
    {
      "path": "inputs/lys/lys.iife.js",
      "sha256": "f896aeae2c680c727d4bb933b9491b8dfa8abf70585359e8966e86987ac4d904"
    },
    {
      "path": "inputs/lys/NOTICE.md",
      "sha256": "e2677fbc9d4c0113ae9e254dada5a4f53e5b02c8b552617c961311db89b6114c"
    },
    {
      "path": "inputs/skill/references/change-over-time.md",
      "sha256": "eb395237d58a5f4d5e277d433bd744b943642684faed95d8102df4a54fbe4a3b"
    },
    {
      "path": "inputs/skill/references/comparison.md",
      "sha256": "fc20172f54b9999bf3c38d169091d1032fa61321c7e40e7c9ed2f9b187b5bb18"
    },
    {
      "path": "inputs/skill/references/composition.md",
      "sha256": "b6d6139d1f0c84126859127e581ce0be1154666a383ecbcbcf163f171f900100"
    },
    {
      "path": "inputs/skill/references/hierarchy.md",
      "sha256": "0093c30b01c1b7c591c547d07d96827c72a5ab23227054be950416dcf5cd0779"
    },
    {
      "path": "inputs/skill/references/integration.md",
      "sha256": "3d67fcfe1c0161c85e51b57ea583251c1f9edb9e1114a7fda75607e91a58f779"
    },
    {
      "path": "inputs/skill/references/relationship.md",
      "sha256": "49857540dd3749e38417504a862c3e5f5775fb5daab874109bf4a63b4eaffd1e"
    },
    {
      "path": "inputs/skill/SKILL.md",
      "sha256": "a09260e864ea2cef5ef7d85493c9a2390c8418cb5837b29d4228b1922f1d37bf"
    },
    {
      "path": "evaluator/answer-key.json",
      "sha256": "3d53ca63c970b641d36ce95748761da4bb728f62c95b330197d0a60f617cb370"
    }
  ],
  "artifacts": {
    "decision": {
      "path": "output/decision.json",
      "sha256": "7e7ef3f395aa97acfc05fb1bade98e5628d941003a31bd2e7992fb5c766c870a"
    },
    "lys_html": {
      "path": "output/slide.html",
      "sha256": "7dbf06b2a91a689946702022d6ff0485a68b8b1cee3bb77305241278c53e3bda"
    },
    "final_response": {
      "path": "output/final-response.md",
      "sha256": "695986956d26ac472b71061c6ca35244c3cccce62b44b606070237ccc9d06348"
    },
    "log": {
      "path": "output/tool.log",
      "sha256": "81eea2eb3ba8e7ec142f7a3d5c038c3b3ac9a67e3494d97826bf059984d70cdc"
    }
  },
  "failure": null
}
