{
  "protocol": "kata-eval/v1",
  "run_id": "release-0.2.0-20261012",
  "manifest": {
    "path": "manifest.json",
    "sha256": "6a928ced45e186d18944836c080c672561247f2c80a70d1a46fde2e4a4ad697e"
  },
  "status": "succeeded",
  "started_at": "2026-10-12T07:12:03.720Z",
  "ended_at": "2026-10-12T07:13:47.289Z",
  "tool": {
    "id": "codex",
    "observed_version": "codex-cli 0.162.1",
    "model": "gpt-6-luna",
    "settings": {
      "cli_args": [
        "exec",
        "--ephemeral",
        "--skip-git-repo-check",
        "-C",
        "/var/folders/5x/92_br_c51191x_mqv5grk7p00000gq/T/kata-eval-workspace-7Wj1DS",
        "-s",
        "workspace-write",
        "-o",
        "/var/folders/5x/92_br_c51191x_mqv5grk7p00000gq/T/kata-eval-workspace-7Wj1DS/output/final-response.md",
        "-m",
        "gpt-6-luna",
        "-"
      ],
      "runner_adapter": {
        "id": "kata-eval-runner/v1",
        "sha256": "278468a2540656425e795763d7886f64d660047a4a2050a3cbf7ae44fd4cf208"
      }
    },
    "exit_code": 0
  },
  "frozen_inputs": [
    {
      "path": "inputs/brief.md",
      "sha256": "f28885c95f4d23075eb72a6bd8b5d780133263e1a9dcb730b4e17e500b3b003d"
    },
    {
      "path": "inputs/prompt.md",
      "sha256": "c363447092b67cae380cdce796ce4181f02e1fcbc912c108168132ab6230ad3a"
    },
    {
      "path": "inputs/lys/lys.css",
      "sha256": "c76f4d3ea763d94527ca6b656d724772bfc5a5946e2096945ea69a047d7077fb"
    },
    {
      "path": "inputs/lys/lys.iife.js",
      "sha256": "f896aeae2c680c727d4bb933b9491b8dfa8abf70585359e8966e86987ac4d904"
    },
    {
      "path": "inputs/lys/NOTICE.md",
      "sha256": "e2677fbc9d4c0113ae9e254dada5a4f53e5b02c8b552617c961311db89b6114c"
    },
    {
      "path": "evaluator/answer-key.json",
      "sha256": "89f4e89007e1eba734eac3f876e9e2c7f95c7f64cc59352d537c6783b8bb8102"
    }
  ],
  "artifacts": {
    "decision": {
      "path": "output/decision.json",
      "sha256": "9773ba8a6cf11f2f8dcfff44bf16553d66e0ee397a7b1cfd37f340fde410f232"
    },
    "lys_html": {
      "path": "output/slide.html",
      "sha256": "88e922c6cb30c7ef122595e42581ca1fd864b58d009a55c14da326dc1b830418"
    },
    "final_response": {
      "path": "output/final-response.md",
      "sha256": "044f197f1abe2bf97a1169efc730083c5805c6dbe63973a68e247e7bfd2db217"
    },
    "log": {
      "path": "output/tool.log",
      "sha256": "0a7de7c2e7d3df555c5b65208418481cf1a7aaef62b274fd8513bd2a846e749a"
    }
  },
  "failure": null
}
