{
  "protocol": "kata-eval/v1",
  "run_id": "release-0.2.0-20261012",
  "manifest": {
    "path": "manifest.json",
    "sha256": "10480e553305b69a727349c833bc76d92d3e039d516e9e526240756ce85c4d46"
  },
  "status": "succeeded",
  "started_at": "2026-10-12T07:23:05.303Z",
  "ended_at": "2026-10-12T07:23:55.123Z",
  "tool": {
    "id": "codex",
    "observed_version": "codex-cli 0.162.1",
    "model": "gpt-6-luna",
    "settings": {
      "cli_args": [
        "exec",
        "--ephemeral",
        "--skip-git-repo-check",
        "-C",
        "/var/folders/5x/92_br_c51191x_mqv5grk7p00000gq/T/kata-eval-workspace-0UuSKg",
        "-s",
        "workspace-write",
        "-o",
        "/var/folders/5x/92_br_c51191x_mqv5grk7p00000gq/T/kata-eval-workspace-0UuSKg/output/final-response.md",
        "-m",
        "gpt-6-luna",
        "-"
      ],
      "runner_adapter": {
        "id": "kata-eval-runner/v1",
        "sha256": "278468a2540656425e795763d7886f64d660047a4a2050a3cbf7ae44fd4cf208"
      }
    },
    "exit_code": 0
  },
  "frozen_inputs": [
    {
      "path": "inputs/brief.md",
      "sha256": "22d2dfbce4985ea35ffa731752949f54047ec0f84e7db40aca8af8ab53ea3c58"
    },
    {
      "path": "inputs/prompt.md",
      "sha256": "c521ed5e8e51e6c2f63c0912e40ec5d5bc2a2e4839484284a248a7cdcac75295"
    },
    {
      "path": "inputs/lys/lys.css",
      "sha256": "c76f4d3ea763d94527ca6b656d724772bfc5a5946e2096945ea69a047d7077fb"
    },
    {
      "path": "inputs/lys/lys.iife.js",
      "sha256": "f896aeae2c680c727d4bb933b9491b8dfa8abf70585359e8966e86987ac4d904"
    },
    {
      "path": "inputs/lys/NOTICE.md",
      "sha256": "e2677fbc9d4c0113ae9e254dada5a4f53e5b02c8b552617c961311db89b6114c"
    },
    {
      "path": "evaluator/answer-key.json",
      "sha256": "3d53ca63c970b641d36ce95748761da4bb728f62c95b330197d0a60f617cb370"
    }
  ],
  "artifacts": {
    "decision": {
      "path": "output/decision.json",
      "sha256": "52c5bf72e9d7e2ea20ee18d1954b389ece61b426a703520c2ef17a9241d02a71"
    },
    "lys_html": {
      "path": "output/slide.html",
      "sha256": "99fc1c84a0b18ec1b6e186a10f1f64129fe733b95f4f41a5250e631ee6faf911"
    },
    "final_response": {
      "path": "output/final-response.md",
      "sha256": "a48b616617fd572299d8ab022fb636fbc00974cd565983c72f4924e330148eaf"
    },
    "log": {
      "path": "output/tool.log",
      "sha256": "e26536e9f03d3cf0b5ca64181a837cb424ab6a109b0b7fc7f04ac5c85600bbfd"
    }
  },
  "failure": null
}
