{
  "protocol": "kata-eval/v1",
  "run_id": "runner-smoke-access",
  "manifest": {
    "path": "manifest.json",
    "sha256": "32fb7b470033908cf070bd2d2626c8c0cdc78540c818fa0d42294d85c372a5c5"
  },
  "status": "failed",
  "started_at": "2026-10-12T07:05:34.816Z",
  "ended_at": "2026-10-12T07:06:44.033Z",
  "tool": {
    "id": "codex",
    "observed_version": "codex-cli 0.162.1",
    "model": "gpt-6-luna",
    "settings": {
      "cli_args": [
        "exec",
        "--ephemeral",
        "--skip-git-repo-check",
        "-C",
        "/var/folders/5x/92_br_c51191x_mqv5grk7p00000gq/T/kata-eval-workspace-QGv5Ot",
        "-s",
        "workspace-write",
        "-o",
        "/var/folders/5x/92_br_c51191x_mqv5grk7p00000gq/T/kata-eval-workspace-QGv5Ot/output/final-response.md",
        "-m",
        "gpt-6-luna",
        "-"
      ]
    },
    "exit_code": 0
  },
  "frozen_inputs": [
    {
      "path": "inputs/brief.md",
      "sha256": "f28885c95f4d23075eb72a6bd8b5d780133263e1a9dcb730b4e17e500b3b003d"
    },
    {
      "path": "inputs/prompt.md",
      "sha256": "a2478c032486dd707f25c7698ea4a8fce06e3becd23a42ab4748b84eaa22ce28"
    },
    {
      "path": "inputs/lys/lys.css",
      "sha256": "c76f4d3ea763d94527ca6b656d724772bfc5a5946e2096945ea69a047d7077fb"
    },
    {
      "path": "inputs/lys/lys.iife.js",
      "sha256": "f896aeae2c680c727d4bb933b9491b8dfa8abf70585359e8966e86987ac4d904"
    },
    {
      "path": "inputs/lys/NOTICE.md",
      "sha256": "e2677fbc9d4c0113ae9e254dada5a4f53e5b02c8b552617c961311db89b6114c"
    },
    {
      "path": "evaluator/answer-key.json",
      "sha256": "89f4e89007e1eba734eac3f876e9e2c7f95c7f64cc59352d537c6783b8bb8102"
    },
    {
      "path": "evaluator/reader-task.md",
      "sha256": "31f6de9cd404d0af618a3096ec178fc08c3a921e7d58c63319360265db85df40"
    }
  ],
  "artifacts": {
    "decision": {
      "path": "output/decision.json",
      "sha256": "9a4f2a0123bd4d535dbf3cb00d052fa779f828bbd5345c4ed75d67575621e57e"
    },
    "lys_html": {
      "path": "output/slide.html",
      "sha256": "63f511996d75e280acf590af658ebd25e85c57290828438230e4ad28f34ac11d"
    },
    "final_response": {
      "path": "output/final-response.md",
      "sha256": "e868eb9cde055cb5a2a0746a110f35ec0271fbd7cf1d5c1c6f3ceb6abdd5c952"
    },
    "log": {
      "path": "output/tool.log",
      "sha256": "441061da117eef259fed81497132f196e49a4d30f4240aacf7d8ef3d1d5d4eae"
    }
  },
  "failure": {
    "reason": "missing or invalid required deliverable(s): valid decision.json (wrong protocol)"
  }
}
